[
  {
    "id": "proto-q01",
    "topic": "UI見本",
    "difficulty": "basic",
    "question_type": "term_mcq",
    "prompt_ja": "小切手で支払ったとき、主に減少するのは？",
    "choices": ["現金", "当座預金", "普通預金", "定期預金"],
    "answer": "当座預金",
    "explanation_ja": "小切手の振出は当座預金の減少。"
  },
  {
    "id": "proto-q02",
    "topic": "UI見本",
    "difficulty": "standard",
    "question_type": "journal_mcq",
    "prompt_ja": "【取引】買掛金50,000円を振込で支払った。",
    "choices": [
      "（借）買掛金 50,000 / （貸）普通預金 50,000",
      "（借）買掛金 50,000 / （貸）当座預金 50,000",
      "（借）仕入 50,000 / （貸）普通預金 50,000",
      "（借）現金 50,000 / （貸）買掛金 50,000"
    ],
    "answer": "（借）買掛金 50,000 / （貸）普通預金 50,000",
    "explanation_ja": "振込は普通預金で処理するのが原則。"
  },
  {
    "id": "proto-q03",
    "topic": "UI見本",
    "difficulty": "standard",
    "question_type": "journal_input",
    "prompt_ja": "【取引】普通預金から現金20,000円を引き出した。",
    "answer": [
      { "side": "Dr", "account": "現金", "amount": 20000 },
      { "side": "Cr", "account": "普通預金", "amount": 20000 }
    ],
    "explanation_ja": "資産間の振替で借貸同額。"
  }
]
