[
  {
    "id": "ch05-q0001",
    "topic": "現金・預金",
    "difficulty": "basic",
    "question_type": "term_mcq",
    "prompt_ja": "小切手を振り出して支払ったとき、主に減少する勘定科目はどれか？",
    "choices": ["現金", "当座預金", "普通預金", "定期預金"],
    "answer": "当座預金",
    "explanation_ja": "小切手の振出は当座預金口座からの支払で処理する。",
    "metadata": { "accounts_used": ["当座預金"], "tags": ["小切手"] }
  },
  {
    "id": "ch05-q0002",
    "topic": "現金・預金",
    "difficulty": "standard",
    "question_type": "journal_mcq",
    "prompt_ja": "【取引】仕入先へ買掛金¥90,000を振込で支払った。正しい仕訳はどれか？",
    "choices": [
      "（借）買掛金 90,000 / （貸）普通預金 90,000",
      "（借）買掛金 90,000 / （貸）当座預金 90,000",
      "（借）現金 90,000 / （貸）買掛金 90,000",
      "（借）仕入 90,000 / （貸）普通預金 90,000"
    ],
    "answer": "（借）買掛金 90,000 / （貸）普通預金 90,000",
    "explanation_ja": "振込は普通預金で処理するのが原則。買掛金の支払は負債の減少（借方）。",
    "metadata": { "accounts_used": ["買掛金", "普通預金"], "tags": ["振込", "買掛金"] }
  },
  {
    "id": "ch05-q0003",
    "topic": "現金・預金",
    "difficulty": "standard",
    "question_type": "journal_input",
    "prompt_ja": "【取引】普通預金から現金¥30,000を引き出した。",
    "answer": [
      { "side": "Dr", "account": "現金", "amount": 30000 },
      { "side": "Cr", "account": "普通預金", "amount": 30000 }
    ],
    "explanation_ja": "資産間の振替。現金が増加（借方）、普通預金が減少（貸方）。",
    "metadata": { "accounts_used": ["現金", "普通預金"], "tags": ["資金移動"] }
  },
  {
    "id": "ch05-q0016",
    "topic": "現金・預金",
    "difficulty": "plus",
    "question_type": "journal_input",
    "prompt_ja": "【取引】仕入先への買掛金¥90,000を振込で支払い、振込手数料¥550も普通預金から引き落とされた。",
    "answer": [
      { "side": "Dr", "account": "買掛金", "amount": 90000 },
      { "side": "Dr", "account": "支払手数料", "amount": 550 },
      { "side": "Cr", "account": "普通預金", "amount": 90550 }
    ],
    "explanation_ja": "振込は普通預金の減少。手数料は費用（支払手数料）。複合仕訳のため借方2行・貸方1行。",
    "metadata": {
      "accounts_used": ["買掛金", "支払手数料", "普通預金"],
      "tags": ["振込", "複合仕訳"]
    }
  },
  {
    "id": "ch05-q0017",
    "topic": "現金・預金",
    "difficulty": "plus",
    "question_type": "journal_input",
    "prompt_ja": "【取引】定期預金¥100,000を満期解約し、利息¥400とともに普通預金に入金された（税等は考慮しない）。",
    "answer": [
      { "side": "Dr", "account": "普通預金", "amount": 100400 },
      { "side": "Cr", "account": "定期預金", "amount": 100000 },
      { "side": "Cr", "account": "受取利息", "amount": 400 }
    ],
    "explanation_ja": "解約により定期預金が減少、同時に利息を受け取り、入金先の普通預金が増加。",
    "metadata": {
      "accounts_used": ["普通預金", "定期預金", "受取利息"],
      "tags": ["満期", "利息", "複合仕訳"]
    }
  },
  {
    "id": "ch05-q0018",
    "topic": "現金・預金",
    "difficulty": "standard",
    "question_type": "journal_input",
    "prompt_ja": "【取引】広告宣伝費¥20,000を小切手を振り出して支払った。",
    "answer": [
      { "side": "Dr", "account": "広告宣伝費", "amount": 20000 },
      { "side": "Cr", "account": "当座預金", "amount": 20000 }
    ],
    "explanation_ja": "小切手支払は当座預金の減少で処理。",
    "metadata": { "accounts_used": ["広告宣伝費", "当座預金"], "tags": ["小切手"] }
  },
  {
    "id": "ch05-q0019",
    "topic": "現金・預金",
    "difficulty": "standard",
    "question_type": "journal_input",
    "prompt_ja": "【取引】普通預金から定期預金¥200,000を預け入れた。",
    "answer": [
      { "side": "Dr", "account": "定期預金", "amount": 200000 },
      { "side": "Cr", "account": "普通預金", "amount": 200000 }
    ],
    "explanation_ja": "資産間の振替で借貸同額。",
    "metadata": { "accounts_used": ["定期預金", "普通預金"], "tags": ["預入", "振替"] }
  },
  {
    "id": "ch05-q0020",
    "topic": "現金・預金",
    "difficulty": "standard",
    "question_type": "journal_input",
    "prompt_ja": "【取引】銀行から¥150,000を借り入れ、当座預金口座に入金を受けた。",
    "answer": [
      { "side": "Dr", "account": "当座預金", "amount": 150000 },
      { "side": "Cr", "account": "借入金", "amount": 150000 }
    ],
    "explanation_ja": "借入により当座預金が増加、対応する負債は借入金。",
    "metadata": { "accounts_used": ["当座預金", "借入金"], "tags": ["借入金"] }
  }
]
