[
  {
    "id": "ch05s2-q01",
    "topic": "現金・預金",
    "difficulty": "standard",
    "question_type": "journal_mcq",
    "prompt_ja": "【取引】仕入先に対する買掛金90,000円を銀行振込で支払った。正しい仕訳はどれか？",
    "choices": [
      "（借）買掛金 90,000 / （貸）普通預金 90,000",
      "（借）買掛金 90,000 / （貸）当座預金 90,000",
      "（借）仕入 90,000 / （貸）普通預金 90,000",
      "（借）現金 90,000 / （貸）買掛金 90,000"
    ],
    "answer": "（借）買掛金 90,000 / （貸）普通預金 90,000",
    "explanation_ja": "振込は普通預金で処理するのが原則。買掛金の減少は借方に記入する。"
  },
  {
    "id": "ch05s2-q02",
    "topic": "現金・預金",
    "difficulty": "standard",
    "question_type": "journal_input",
    "prompt_ja": "【取引】小切手を振り出して備品150,000円を購入した。",
    "answer": [
      {
        "side": "Dr",
        "account": "備品",
        "amount": 150000
      },
      {
        "side": "Cr",
        "account": "当座預金",
        "amount": 150000
      }
    ],
    "explanation_ja": "小切手支払は当座預金の減少（貸方）で処理する。"
  },
  {
    "id": "ch05s2-q03",
    "topic": "現金・預金",
    "difficulty": "standard",
    "question_type": "journal_mcq",
    "prompt_ja": "【取引】得意先からの振込で売掛金50,000円を回収した。正しい仕訳はどれか？",
    "choices": [
      "（借）当座預金 50,000 / （貸）売掛金 50,000",
      "（借）普通預金 50,000 / （貸）売掛金 50,000",
      "（借）現金 50,000 / （貸）売掛金 50,000",
      "（借）売掛金 50,000 / （貸）普通預金 50,000"
    ],
    "answer": "（借）普通預金 50,000 / （貸）売掛金 50,000",
    "explanation_ja": "振込入金は普通預金の増加（借方）。売掛金の減少は貸方。"
  },
  {
    "id": "ch05s2-q04",
    "topic": "現金・預金",
    "difficulty": "basic",
    "question_type": "term_mcq",
    "prompt_ja": "「銀行振込」の支払に通常用いる勘定はどれか？",
    "choices": ["現金", "普通預金", "当座預金", "受取手形"],
    "answer": "普通預金",
    "explanation_ja": "銀行振込は普通預金で処理する。"
  }
]
