[
  {
    "id": "ch03-q01",
    "topic": "帳簿と伝票",
    "difficulty": "basic",
    "question_type": "term_mcq",
    "prompt_ja": "次のうち、取引を日付順に記録する帳簿はどれ？",
    "choices": ["仕訳帳", "総勘定元帳", "試算表", "補助元帳"],
    "answer": "仕訳帳",
    "explanation_ja": "仕訳帳は時系列、元帳は科目別、試算表は全体の合計と残高を一覧にする。"
  },
  {
    "id": "ch03-q02",
    "topic": "帳簿と伝票",
    "difficulty": "basic",
    "question_type": "term_mcq",
    "prompt_ja": "お金を払ったときに用いる伝票はどれ？",
    "choices": ["入金伝票", "出金伝票", "振替伝票", "売上伝票"],
    "answer": "出金伝票",
    "explanation_ja": "出金伝票は現金などの支払時に用いる。"
  },
  {
    "id": "ch03-q03",
    "topic": "帳簿と伝票",
    "difficulty": "standard",
    "question_type": "journal_input",
    "prompt_ja": "【取引】レシート：消耗品を現金で1,200円購入した。",
    "answer": [
      {
        "side": "Dr",
        "account": "消耗品費",
        "amount": 1200
      },
      {
        "side": "Cr",
        "account": "現金",
        "amount": 1200
      }
    ],
    "explanation_ja": "費用の発生は借方、現金の支払は貸方。"
  },
  {
    "id": "ch03-q04",
    "topic": "帳簿と伝票",
    "difficulty": "standard",
    "question_type": "journal_input",
    "prompt_ja": "【取引】得意先から売掛金50,000円の振込入金があった。",
    "answer": [
      {
        "side": "Dr",
        "account": "普通預金",
        "amount": 50000
      },
      {
        "side": "Cr",
        "account": "売掛金",
        "amount": 50000
      }
    ],
    "explanation_ja": "振込入金は普通預金（借方）、売掛金の減少は貸方。"
  },
  {
    "id": "ch03-q05",
    "topic": "帳簿と伝票",
    "difficulty": "basic",
    "question_type": "term_mcq",
    "prompt_ja": "次の並びのうち、正しい処理の順序はどれ？",
    "choices": [
      "仕訳 → 証ひょう → 伝票 → 元帳 → 試算表",
      "証ひょう → 伝票 → 仕訳 → 元帳 → 試算表",
      "証ひょう → 仕訳 → 伝票 → 元帳 → 試算表",
      "伝票 → 証ひょう → 仕訳 → 元帳 → 試算表"
    ],
    "answer": "証ひょう → 伝票 → 仕訳 → 元帳 → 試算表",
    "explanation_ja": "証ひょう（証拠）→ 伝票（指示書）→ 仕訳（記録）→ 元帳（科目別）→ 試算表（全体確認）。"
  },
  {
    "id": "ch03-q06",
    "topic": "帳簿と伝票",
    "difficulty": "standard",
    "question_type": "journal_mcq",
    "prompt_ja": "【取引】小切手を振り出して備品20,000円を購入した。正しい仕訳はどれ？",
    "choices": [
      "（借）備品 20,000 / （貸）当座預金 20,000",
      "（借）備品 20,000 / （貸）普通預金 20,000",
      "（借）消耗品費 20,000 / （貸）現金 20,000",
      "（借）当座預金 20,000 / （貸）備品 20,000"
    ],
    "answer": "（借）備品 20,000 / （貸）当座預金 20,000",
    "explanation_ja": "小切手の振出は当座預金からの支払。備品の取得は借方。"
  }
]
